{
  "findings": [
    {
      "confidence": "high",
      "current": "6.0.0",
      "evidence": "npm registry query",
      "latest": "6.0.2",
      "package": "codelyzer",
      "reason": "Deprecated. Use angular-eslint instead.",
      "riskCategory": "deprecated",
      "riskLevel": "high",
      "source": "package.json",
      "type": "deprecated_package"
    },
    {
      "confidence": "high",
      "current": "6.1.0",
      "evidence": "npm registry query",
      "latest": "6.1.3",
      "package": "tslint",
      "reason": "TSLint has been deprecated in favor of ESLint. Please see https://github.com/palantir/tslint/issues/4534 for more information.",
      "riskCategory": "deprecated",
      "riskLevel": "high",
      "source": "package.json",
      "type": "deprecated_package"
    },
    {
      "confidence": "high",
      "current": "12.1.0",
      "evidence": "npm registry query",
      "latest": "21.2.11",
      "package": "@angular-devkit/build-angular",
      "reason": null,
      "riskCategory": "breaking-compatibility",
      "riskLevel": "high",
      "source": "package.json",
      "type": "outdated_package"
    },
    {
      "confidence": "high",
      "current": "12.1.0",
      "evidence": "npm registry query",
      "latest": "21.2.13",
      "package": "@angular/animations",
      "reason": null,
      "riskCategory": "breaking-compatibility",
      "riskLevel": "high",
      "source": "package.json",
      "type": "outdated_package"
    },
    {
      "confidence": "high",
      "current": "12.1.0",
      "evidence": "npm registry query",
      "latest": "21.2.11",
      "package": "@angular/cli",
      "reason": null,
      "riskCategory": "breaking-compatibility",
      "riskLevel": "high",
      "source": "package.json",
      "type": "outdated_package"
    },
    {
      "confidence": "high",
      "current": "12.1.0",
      "evidence": "npm registry query",
      "latest": "21.2.13",
      "package": "@angular/common",
      "reason": null,
      "riskCategory": "breaking-compatibility",
      "riskLevel": "high",
      "source": "package.json",
      "type": "outdated_package"
    },
    {
      "confidence": "high",
      "current": "12.1.0",
      "evidence": "npm registry query",
      "latest": "21.2.13",
      "package": "@angular/compiler",
      "reason": null,
      "riskCategory": "breaking-compatibility",
      "riskLevel": "high",
      "source": "package.json",
      "type": "outdated_package"
    },
    {
      "confidence": "high",
      "current": "12.1.0",
      "evidence": "npm registry query",
      "latest": "21.2.13",
      "package": "@angular/compiler-cli",
      "reason": null,
      "riskCategory": "breaking-compatibility",
      "riskLevel": "high",
      "source": "package.json",
      "type": "outdated_package"
    },
    {
      "confidence": "high",
      "current": "12.1.0",
      "evidence": "npm registry query",
      "latest": "21.2.13",
      "package": "@angular/core",
      "reason": null,
      "riskCategory": "breaking-compatibility",
      "riskLevel": "high",
      "source": "package.json",
      "type": "outdated_package"
    },
    {
      "confidence": "high",
      "current": "12.1.0",
      "evidence": "npm registry query",
      "latest": "21.2.13",
      "package": "@angular/forms",
      "reason": null,
      "riskCategory": "breaking-compatibility",
      "riskLevel": "high",
      "source": "package.json",
      "type": "outdated_package"
    },
    {
      "confidence": "high",
      "current": "12.1.0",
      "evidence": "npm registry query",
      "latest": "21.2.13",
      "package": "@angular/platform-browser",
      "reason": null,
      "riskCategory": "breaking-compatibility",
      "riskLevel": "high",
      "source": "package.json",
      "type": "outdated_package"
    },
    {
      "confidence": "high",
      "current": "12.1.0",
      "evidence": "npm registry query",
      "latest": "21.2.13",
      "package": "@angular/platform-browser-dynamic",
      "reason": null,
      "riskCategory": "breaking-compatibility",
      "riskLevel": "high",
      "source": "package.json",
      "type": "outdated_package"
    },
    {
      "confidence": "high",
      "current": "12.1.0",
      "evidence": "npm registry query",
      "latest": "21.2.13",
      "package": "@angular/router",
      "reason": null,
      "riskCategory": "breaking-compatibility",
      "riskLevel": "high",
      "source": "package.json",
      "type": "outdated_package"
    },
    {
      "confidence": "high",
      "current": "12.11.1",
      "evidence": "npm registry query",
      "latest": "25.8.0",
      "package": "@types/node",
      "reason": null,
      "riskCategory": "breaking-compatibility",
      "riskLevel": "high",
      "source": "package.json",
      "type": "outdated_package"
    },
    {
      "confidence": "high",
      "current": "6.3.0",
      "evidence": "npm registry query",
      "latest": "6.4.4",
      "package": "karma",
      "reason": null,
      "riskCategory": "breaking-compatibility",
      "riskLevel": "low",
      "source": "package.json",
      "type": "outdated_package"
    },
    {
      "confidence": "high",
      "current": "3.1.0",
      "evidence": "npm registry query",
      "latest": "3.2.0",
      "package": "karma-chrome-launcher",
      "reason": null,
      "riskCategory": "breaking-compatibility",
      "riskLevel": "low",
      "source": "package.json",
      "type": "outdated_package"
    },
    {
      "confidence": "high",
      "current": "2.0.3",
      "evidence": "npm registry query",
      "latest": "2.2.1",
      "package": "karma-coverage",
      "reason": null,
      "riskCategory": "breaking-compatibility",
      "riskLevel": "low",
      "source": "package.json",
      "type": "outdated_package"
    },
    {
      "confidence": "high",
      "current": "4.0.0",
      "evidence": "npm registry query",
      "latest": "5.1.0",
      "package": "karma-jasmine",
      "reason": null,
      "riskCategory": "breaking-compatibility",
      "riskLevel": "low",
      "source": "package.json",
      "type": "outdated_package"
    },
    {
      "confidence": "high",
      "current": "1.7.0",
      "evidence": "npm registry query",
      "latest": "2.2.0",
      "package": "karma-jasmine-html-reporter",
      "reason": null,
      "riskCategory": "breaking-compatibility",
      "riskLevel": "low",
      "source": "package.json",
      "type": "outdated_package"
    },
    {
      "confidence": "high",
      "current": "6.6.0",
      "evidence": "npm registry query",
      "latest": "7.8.2",
      "package": "rxjs",
      "reason": null,
      "riskCategory": "breaking-compatibility",
      "riskLevel": "medium",
      "source": "package.json",
      "type": "outdated_package"
    },
    {
      "confidence": "high",
      "current": "2.2.0",
      "evidence": "npm registry query",
      "latest": "2.8.1",
      "package": "tslib",
      "reason": null,
      "riskCategory": "breaking-compatibility",
      "riskLevel": "low",
      "source": "package.json",
      "type": "outdated_package"
    },
    {
      "confidence": "high",
      "current": "4.2.3",
      "evidence": "npm registry query",
      "latest": "6.0.3",
      "package": "typescript",
      "reason": null,
      "riskCategory": "breaking-compatibility",
      "riskLevel": "medium",
      "source": "package.json",
      "type": "outdated_package"
    },
    {
      "confidence": "high",
      "current": "0.11.4",
      "evidence": "npm registry query",
      "latest": "0.16.2",
      "package": "zone.js",
      "reason": null,
      "riskCategory": "breaking-compatibility",
      "riskLevel": "low",
      "source": "package.json",
      "type": "outdated_package"
    },
    {
      "confidence": "high",
      "evidence": "semver peer constraint check",
      "installedVersion": "12.1.0",
      "package": "@angular/animations",
      "requiredBy": "@angular/platform-browser",
      "requiredRange": "21.2.13",
      "source": "package.json + lockfile",
      "type": "peer_conflict",
      "unresolvable": false
    },
    {
      "confidence": "high",
      "evidence": "semver peer constraint check",
      "installedVersion": "12.1.0",
      "package": "@angular/common",
      "requiredBy": "@angular/forms",
      "requiredRange": "21.2.13",
      "source": "package.json + lockfile",
      "type": "peer_conflict",
      "unresolvable": false
    },
    {
      "confidence": "high",
      "evidence": "semver peer constraint check",
      "installedVersion": "12.1.0",
      "package": "@angular/common",
      "requiredBy": "@angular/platform-browser",
      "requiredRange": "21.2.13",
      "source": "package.json + lockfile",
      "type": "peer_conflict",
      "unresolvable": false
    },
    {
      "confidence": "high",
      "evidence": "semver peer constraint check",
      "installedVersion": "12.1.0",
      "package": "@angular/common",
      "requiredBy": "@angular/platform-browser-dynamic",
      "requiredRange": "21.2.13",
      "source": "package.json + lockfile",
      "type": "peer_conflict",
      "unresolvable": false
    },
    {
      "confidence": "high",
      "evidence": "semver peer constraint check",
      "installedVersion": "12.1.0",
      "package": "@angular/common",
      "requiredBy": "@angular/router",
      "requiredRange": "21.2.13",
      "source": "package.json + lockfile",
      "type": "peer_conflict",
      "unresolvable": false
    },
    {
      "confidence": "high",
      "evidence": "semver peer constraint check",
      "installedVersion": "12.1.0",
      "package": "@angular/compiler",
      "requiredBy": "@angular/core",
      "requiredRange": "21.2.13",
      "source": "package.json + lockfile",
      "type": "peer_conflict",
      "unresolvable": false
    },
    {
      "confidence": "high",
      "evidence": "semver peer constraint check",
      "installedVersion": "12.1.0",